{
  "schema_version": 1,
  "id": 4,
  "slug": "d004",
  "title": "Dasakam 4",
  "description": "Bhattathiri contemplates the practice of yoga, liberation, and refuge in the Lord.",
  "editorial_status": "needs-review",
  "source": {
    "commentary": "intake/D004/photo-captions.txt",
    "raw_post": "intake/D004/post.json",
    "status": "unreviewed source captions; Sanskrit and translation pending"
  },
  "stanzas": [
    {
      "n": 1,
      "sanskrit": "",
      "stanza_roman": "",
      "translation_en": "",
      "commentary_en": "Narayana Bhattathiri requested Bhagwan Guruvayoorappan to give him enough of adequate good health to practice Ashtanga yoga and earn HIS grace.",
      "commentary_source": "intake/D004/photo-captions.txt#001",
      "review_status": "needs-review"
    },
    {
      "n": 2,
      "sanskrit": "",
      "stanza_roman": "",
      "translation_en": "",
      "commentary_en": "The practice of Ashtanga yoga include self control (Yama) by practice of brahmacharya, follow a code of conduct (Niyama) like taking bath & attain purity of body and mind by sitting in an appropriate posture (Asana) like Padmasana or Sukhasana to meditate upon Bhagwan.",
      "commentary_source": "intake/D004/photo-captions.txt#002",
      "review_status": "needs-review"
    },
    {
      "n": 3,
      "sanskrit": "",
      "stanza_roman": "",
      "translation_en": "",
      "commentary_en": "Bhattathiri continues that by regulating breath through Pranayama and having purified, he will continuously chant the Pranava (Om) mantra mentally and withdraw his senses from the sense objects (Pratyahara), and prepare himself for meditation on Bhagwan.",
      "commentary_source": "intake/D004/photo-captions.txt#003",
      "review_status": "needs-review"
    },
    {
      "n": 4,
      "sanskrit": "",
      "stanza_roman": "",
      "translation_en": "",
      "commentary_en": "After attaining the above, Bhattathiri would try hard to fix his mind (Dharana)on the lotus feet of the hazily perceived form of Bhagwan. Practicing again and again he shall attain bliss of devotion and tenderness of heart.",
      "commentary_source": "intake/D004/photo-captions.txt#004",
      "review_status": "needs-review"
    },
    {
      "n": 5,
      "sanskrit": "",
      "stanza_roman": "",
      "translation_en": "",
      "commentary_en": "With prolonged meditation (Dhyana) and surrender, he would then be successful in visualising Bhagwan’s form more clearly in an effortless manner.",
      "commentary_source": "intake/D004/photo-captions.txt#005",
      "review_status": "needs-review"
    },
    {
      "n": 6,
      "sanskrit": "",
      "stanza_roman": "",
      "translation_en": "",
      "commentary_en": "Having been captivated by Bhagwan’s sweet form (Saguna), he would then be able to enjoy the impersonal form of Bhagwan which is Parabrahman or the Nirguna form.",
      "commentary_source": "intake/D004/photo-captions.txt#006",
      "review_status": "needs-review"
    },
    {
      "n": 7,
      "sanskrit": "",
      "stanza_roman": "",
      "translation_en": "",
      "commentary_en": "While practicing such a nirvikalpa Samadhi state, if Bhattathiri missed his focus, he would start from the meditation process, Dhaarana onwards.",
      "commentary_source": "intake/D004/photo-captions.txt#007",
      "review_status": "needs-review"
    },
    {
      "n": 8,
      "sanskrit": "",
      "stanza_roman": "",
      "translation_en": "",
      "commentary_en": "Thus having attained the joy of experiencing the Supreme Blissful state, Bhattathiri requests Bhagwan to make him the foremost of the liberated devotees and move about freely like Sri Shuka, Naradha and others.",
      "commentary_source": "intake/D004/photo-captions.txt#008",
      "review_status": "needs-review"
    },
    {
      "n": 9,
      "sanskrit": "",
      "stanza_roman": "",
      "translation_en": "",
      "commentary_en": "After one achieves this Samaadhi state, he can opt for immediate liberation (Sadhyo Mukthi) or gradual liberation (Krama Mukthi). In both ways, one should first control the breath by Pranayama and then make it arise from the Mooladhara chakra to higher six chakras through the Sushumna naadi.",
      "commentary_source": "intake/D004/photo-captions.txt#009",
      "review_status": "needs-review"
    },
    {
      "n": 10,
      "sanskrit": "",
      "stanza_roman": "",
      "translation_en": "",
      "commentary_en": "One who is not interested in heavenly worlds, gives up his gross and subtle body and merges with Bhagwan through the Aajnya chakra. One who desires to visit heavenly worlds, before attaining liberation, then leaves his breath through the Brahmarandra or through the orifice in the crown of the head.",
      "commentary_source": "intake/D004/photo-captions.txt#010",
      "review_status": "needs-review"
    },
    {
      "n": 11,
      "sanskrit": "",
      "stanza_roman": "",
      "translation_en": "",
      "commentary_en": "Bhagwan’s devotee who follows the Krama Mukti path is led by the presiding deities of fire, day time, the bright fortnight, and Uttaraayana to the plane of the sun and enjoys in each of these spheres & reaches the realm of Dhruva.",
      "commentary_source": "intake/D004/photo-captions.txt#011",
      "review_status": "needs-review"
    },
    {
      "n": 12,
      "sanskrit": "",
      "stanza_roman": "",
      "translation_en": "",
      "commentary_en": "Reaching the abode of Dhruva, he proceeds to Maharloka. When, at the approach of cosmic dissolution, fire emanates from the mouth of Aadishesh, and when he is tormented by the fire, he takes refuge in Bhagwan and goes to Brahmaloka.",
      "commentary_source": "intake/D004/photo-captions.txt#012",
      "review_status": "needs-review"
    },
    {
      "n": 13,
      "sanskrit": "",
      "stanza_roman": "",
      "translation_en": "",
      "commentary_en": "The devotee residing in Brahma loka or Bhagwan’s Vaikunta is then liberated during Mahapralaya or if he desires, even much earlier by liberating himself with his yogic powers.",
      "commentary_source": "intake/D004/photo-captions.txt#013",
      "review_status": "needs-review"
    },
    {
      "n": 14,
      "sanskrit": "",
      "stanza_roman": "",
      "translation_en": "",
      "commentary_en": "The liberated devotee enters each of the seven sheaths of the cosmic sphere,i.e. earth, water, fire, air, space, the cosmic intelligence, and primordial nature. He enjoys the bliss there and then merges with Bhagwan, the Supreme Brahman.",
      "commentary_source": "intake/D004/photo-captions.txt#014",
      "review_status": "needs-review"
    },
    {
      "n": 15,
      "sanskrit": "",
      "stanza_roman": "",
      "translation_en": "",
      "commentary_en": "The devotee who thus goes through the luminous path does not fall any more to the netherworlds. Bhattathiri worships the embodiment of pure consciousness absolute, to protect him who  ever sings  Bhagwan’s glories.",
      "commentary_source": "intake/D004/photo-captions.txt#015",
      "review_status": "needs-review"
    }
  ]
}
