{
  "schema_version": 1,
  "id": 96,
  "slug": "d096",
  "title": "Dasakam 96",
  "description": "Sloka 4 trial: knowledge, selfless action and devotion.",
  "editorial_status": "needs-review",
  "source": {
    "commentary": "content/sources/d096/photo-captions.txt"
  },
  "stanzas": [
    {
      "n": 4,
      "sanskrit": "",
      "stanza_roman": "",
      "translation_en": "",
      "commentary_en": "Jnana, Karma and Bhakti are the three different yogic paths to reach Bhagwan. \nThose who are fully dispassionate towards everything in life, the path of Jnana yoga suits best. For those who possess worldly attachments, the path of Karma yoga is best to follow. To those who are neither intensely attached nor intensely dispassionate and also prefer experiencing Bhagwan, the path of Bhaakti is prescribed.",
      "commentary_source": "content/sources/d096/photo-captions.txt#004",
      "review_status": "needs-review"
    }
  ]
}
